{
  "$schema":"https://json-schema.org/draft/2020-12/schema",
  "$id":"https://mwm.local/schemas/eqa/invocation-envelope.schema.json",
  "title":"EQA Invocation Envelope",
  "type":"object",
  "additionalProperties":false,
  "required":["run_id","chapter_id","requested_stage","purpose","input_artifacts","authority_context","risk_profile","requested_outputs","human_owner","confidentiality_route","orchestrator_version"],
  "properties":{
    "run_id":{"type":"string","pattern":"^EQA-RUN-"},"chapter_id":{"type":"string"},"requested_stage":{"type":"string","enum":["intake","editorial_review","production","proof","release","post_publication"]},"purpose":{"type":"string","minLength":1},"input_artifacts":{"type":"array","items":{"type":"object","additionalProperties":false,"required":["artifact_id","path_or_uri","file_type","version_id","fixity","access_status"],"properties":{"artifact_id":{"type":"string"},"path_or_uri":{"type":"string"},"file_type":{"type":"string"},"version_id":{"type":"string"},"fixity":{"type":["string","null"]},"access_status":{"type":"string","enum":["local","linked","protected","web_only","unavailable"]}}}},"authority_context":{"type":"array","items":{"type":"object","additionalProperties":false,"required":["authority_id","version","tier","scope","status"],"properties":{"authority_id":{"type":"string"},"version":{"type":"string"},"tier":{"type":"integer","minimum":1,"maximum":8},"scope":{"type":"string"},"status":{"type":"string","enum":["approved","provisional","conflict","superseded"]}}}},"risk_profile":{"type":"object","additionalProperties":false,"required":["consequence","sensitivity","uncertainty","irreversibility","output_exposure"],"properties":{"consequence":{"type":"string","enum":["low","moderate","high","critical"]},"sensitivity":{"type":"string","enum":["public","internal","confidential","highly_sensitive"]},"uncertainty":{"type":"string","enum":["low","moderate","high","unknown"]},"irreversibility":{"type":"string","enum":["low","moderate","high","critical"]},"output_exposure":{"type":"string","enum":["internal","author","production","public"]}}},"requested_outputs":{"type":"array","items":{"type":"string"}},"human_owner":{"type":["string","null"]},"confidentiality_route":{"type":"object","additionalProperties":false,"required":["route_id","status","data_class","retention_class"],"properties":{"route_id":{"type":"string"},"status":{"type":"string","enum":["approved","pending","denied"]},"data_class":{"type":"string"},"retention_class":{"type":"string"}}},"orchestrator_version":{"type":"string"},"prior_run_id":{"type":["string","null"]},"created_at":{"type":["string","null"],"format":"date-time"}
  }
}
