{"run_id":"EQA-RUN-EXAMPLE-001","chapter_id":"CH-EXAMPLE","requested_stage":"editorial_review","purpose":"route bounded family review","input_artifacts":[{"artifact_id":"ART-CH","path_or_uri":"chapter.docx","file_type":"docx","version_id":"v1","fixity":"sha256:example","access_status":"local"}],"authority_context":[{"authority_id":"MWM-EQA-SPEC","version":"0.1.0","tier":1,"scope":"orchestration","status":"approved"}],"risk_profile":{"consequence":"moderate","sensitivity":"internal","uncertainty":"moderate","irreversibility":"moderate","output_exposure":"internal"},"requested_outputs":["dependency_graph","family_reports","coverage","receipt"],"human_owner":"volume editor","confidentiality_route":{"route_id":"local-approved","status":"approved","data_class":"internal","retention_class":"project"},"orchestrator_version":"0.1.0","prior_run_id":null,"created_at":"2026-08-14T00:00:00Z"}
